{
  "submittedOn": "2023-10-21T10:59:47.544Z",
  "fromDate": "2022-07-21",
  "toDate": "2022-08-21",
  "ukFhlProperty": {
    "income": {
      "periodAmount": 5000.99,
      "taxDeducted": 3123.21,
      "rentARoom": {
        "rentsReceived": 532.12
      }
    },
    "expenses": {
      "consolidatedExpenses": 988.18
    }
  },
  "ukNonFhlProperty": {
    "income": {
      "premiumsOfLeaseGrant": 4889.23,
      "reversePremiums": 847.35,
      "periodAmount": 747.45,
      "taxDeducted": 984.29,
      "otherIncome": 954.32,
      "rentARoom": {
        "rentsReceived": 488.39
      }
    },
    "expenses": {
      "consolidatedExpenses": 988.18
    }
  },
  "links": [
    {
      "href": "/individuals/business/property/uk/KZ816096B/XAIS12345678910/period/2022-23/4557ecb5-fd32-48cc-81f5-e6acd1099f3c",
      "method": "PUT",
      "rel": "amend-uk-property-period-summary"
    },
    {
      "href": "/individuals/business/property/uk/KZ816096B/XAIS12345678910/period/2022-23/4557ecb5-fd32-48cc-81f5-e6acd1099f3c",
      "method": "GET",
      "rel": "self"
    },
    {
      "href": "/individuals/business/property/KZ816096B/XAIS12345678910/period/2022-23",
      "method": "GET",
      "rel": "list-property-period-summaries"
    }
  ]
}